{
  "schemaVersion": 1,
  "kind": "skill-selection",
  "runId": "run-188",
  "selectedAt": "2026-06-11T12:00:00.000Z",
  "source": {
    "repo": "ArchonVII/jma-skill-review",
    "root": "shared/",
    "catalogRelpath": "docs/skill-catalog.md",
    "commit": "aaaaaaaaaaaaaaaaaaaaaaaaaaaaaaaaaaaaaaaa"
  },
  "discovery": {
    "status": "catalog-unreadable",
    "fallback": "proceeded-without-skills",
    "dirtyPaths": [],
    "error": "ENOENT: no such file or directory"
  },
  "noRelevantSkill": false,
  "selections": []
}
